Title,Description,Price,Manufactured Year,Region
ВАЗ (Lada) Самара (хэтчбек 2109),"1990г., Газ-бензин, Серый, Хэтчбек, КПП Механика, Багажник, Обогрев зеркал, Аудиосистема, CD, CD-чейнджер, MP3, USB, DVD, DVD-…",1289,1990,Самарканд
Hyundai Starex,"1997г., 2.2 л, Газ-бензин, Универсал, КПП Механика, Матор новый ремонт нолдан апкаткада Темир метан дакументалный запас матори…",5000,1997,Наманган
"Chevrolet Cobalt, 4 позиция","Есть доставкаТорг есть 2022г., 1.5 л, Бензин, Белый, Седан, КПП Автомат, Литые диски, Люк, Рейлинги, Противотуманки, Обогрев зеркал, Гидравлика руля,…",13000,2022,Бухара
"Chevrolet Spark, 2 позиция","Торг есть 2020г., 1.6 л, Бензин, 27 000 км, Белый, Хэтчбек, КПП Механика, Противотуманки, Обогрев зеркал, Шторки, Аудиосистема, USB, DVD…",8200,2020,Бухара
Daewoo Espero,"1995г., 2 л, Газ-бензин, Вишня, Седан, КПП Механика",4000,1995,Самарканд
"Chevrolet Lacetti, 2 позиция","Есть доставкаТорг есть 2018г., 1.5 л, Бензин, Седан, КПП Механика, Обогрев зеркал, Противотуманки, Аудиосистема, Полный электропакет, Гидравлика руля…",11400,2018,Ташкент
Daewoo Damas,"Торг есть 2008г., Газ-бензин, Молочный цвет, Седан, КПП Механика",4500,2008,Самарканд
"Chevrolet Cobalt, 2 позиция","2019г., 1.5 л, Бензин, 25 800 км, Белый, Седан, КПП Механика, Противотуманки, Обогрев зеркал, Аудиосистема, ABS, Подушка безоп…",11500,2019,Джизак
ВАЗ (Lada) 2106,"1985г., Газ-бензин, Седан, КПП Механика",2500,1985,Андижан
"Chevrolet Cobalt, 2 позиция","Торг есть 2014г., 1.5 л, Газ-бензин, 196 000 км, Дельфин, Седан, КПП Механика, Литые диски, Противотуманки, Обогрев зеркал, Аудиосистема…",8270,2014,Наманган
"Chevrolet Nexia 2, 2 позиция DOHC","Торг есть 2009г., 1.6 л, Газ-бензин, 228 000 км, Седан, КПП Механика, Аудиосистема, Гидравлика руля, Kraska bor zanglaganga eshiklarga s…",4600,2009,Шахриханский район
Daewoo Nexia,"2008г., 1.6 л, Газ-бензин, 279 000 км, Серебристый, Седан, КПП Механика, Урилмаган сурилмаган нармални састаяния",4500,2008,Ургенч
"Chevrolet Lacetti, 2 позиция","Торг есть 2013г., 1.5 л, Газ-бензин, 208 000 км, Седан, КПП Механика, Багажник, Противотуманки, Обогрев зеркал, Кожа, Аудиосистема, CD,…",8800,2013,Асакинский район
ВАЗ (Lada) Largus,"2019г., Газ-бензин, 85 км, Универсал, КПП Механика, Велюр",13900,2019,Бухара
"Chevrolet Nexia 2, 2 позиция SOHC","2009г., 7.5 л, Бензин, 12 000 км, Седан, КПП Механика, Аудиосистема, Гидравлика руля, Mashina holati a'lo kiraskasi toza. Real…",8000,2009,Самарканд
Chevrolet Damas,"Торг есть 2009г., Газ-бензин, 302 000 км, Молочный цвет, Хэтчбек, КПП Механика, Mator yangi qilingan endi 7ming yurdi, mos, karobka, xad…",4900,2009,Наманган
"Chevrolet Matiz, 4 позиция","Торг есть 2012г., 0.8 л, Газ-бензин, 215 000 км, Хэтчбек, КПП Механика, Литые диски, Рейлинги, Аудиосистема, Кондиционер",3683,2012,Навои
"Chevrolet Captiva, 4 позиция","2018г., 2.4 л, Бензин, Кроссовер, КПП Автомат, Багажник, Рейлинги, Люк, Панорамная крыша, Литые диски, Противотуманки, Обогрев…",28000,2018,Самарканд
Daewoo Tico,"1997г., Бензин, Хэтчбек, КПП Механика",1289,1997,Самарканд
"Chevrolet Cobalt, 2 позиция","2014г., 1.5 л, Газ-бензин, 90 600 км, Седан, КПП Механика, Противотуманки, Обогрев зеркал, Аудиосистема, ABS, Подушка безопасн…",7900,2014,Самарканд
Daewoo Tico,"Торг есть 1993г., 0.8 л, Бензин, 61 383 км, Белый, Хэтчбек, КПП Механика, Хрустальная оптика, Аудиосистема, Bluetooth, MP3, Краска килин…",1934,1993,Навои
"Chevrolet Lacetti, 1 позиция Газ-бензин","2019г., 1.5 л, Газ-бензин, Седан, КПП Механика, Обогрев зеркал, Аудиосистема, ABS, Кондиционер, Гидравлика руля, Полный электр…",11500,2019,Наманган
"Chevrolet Spark, 2 позиция","Торг есть 2018г., 1.3 л, Бензин, 9 750 км, Хэтчбек, КПП Механика, Противотуманки, Аудиосистема, Гидравлика руля, ABS, Подушка безопаснос…",7800,2018,Бухара
"Chevrolet Cobalt, 2 евро позиция","Есть доставка 2020г., 1.5 л, Газ-бензин, 40 000 км, Седан, КПП Механика, Литые диски, Противотуманки, Обогрев зеркал, Аудиосистема, Гидравли…",8500,2020,Ташкент
Chrysler 300C,"2007г., 2.7 л, Бензин, 158 000 км, Седан, КПП Автомат, Mashinani xarajati yoq Pul topar mashina",13000,2007,Бухара
"Chevrolet Lacetti, 2 позиция","Есть доставкаТорг есть 2009г., 1.8 л, Газ-бензин, 222 км, Седан, КПП Механика, Литые диски, Люк, Противотуманки, Обогрев зеркал, Аудиосистема, Гидрав…",8287,2009,Шерабадский район
ВАЗ (Lada) 2107,"1980г., 1.5 л, Газ-бензин, 111 111 км, Седан, КПП Механика, Алькантара, Шторки, Аудиосистема, Встроенный телефон, CD-чейнджер,…",1900,1980,Гурленский район
"Chevrolet Nexia 3, 2 позиция","Торг есть 2020г., 1.5 л, Бензин, 27 000 км, Седан, КПП Механика, Противотуманки, Аудиосистема, Гидравлика руля, ABS, Подушка безопасност…",9000,2020,Ташкент
Daewoo Damas,"1998г., Газ-бензин, Седан, КПП Механика, MP3",2300,1998,Самарканд
Daewoo Matiz (Standart),"Торг есть 2010г., Бензин, 200 км, Хэтчбек, КПП Механика, Аудиосистема, Moshina tozza hichqanaqa ishi yoq mator karopka ochilmagan hullas…",4300,2010,Ташкент
Daewoo Nexia,"2010г., Газ-бензин, 250 000 км, Белый, Седан, КПП Механика, Аудиосистема, Urilmagan kraskasi chaqa chuqalarda bor suyagi butun",6000,2010,Ташкент
Daewoo Tico,"1999г., Газ-бензин, Белый, Хэтчбек, КПП Механика, Литые диски, Тонировка, Люк, Велюр, Шторки",1842,1999,Бухара
"Chevrolet Cobalt, 2 позиция","2013г., 1.5 л, Газ-бензин, 181 000 км, Седан, КПП Механика, Противотуманки, Обогрев зеркал, Аудиосистема, ABS, Кондиционер, По…",8103,2013,Карши
"Chevrolet Spark, 2 позиция","Торг есть 2012г., 1.1 л, Газ-бензин, 335 500 км, Жёлто-зеленый, Хэтчбек, КПП Механика, Противотуманки, Аудиосистема, Гидравлика руля, AB…",7827,2012,Нукус
"Chevrolet Nexia 2, 4 позиция SOHC","2015г., 1.5 л, Бензин, 13 000 км, Белый, Седан, КПП Механика, Противотуманки, Аудиосистема, Гидравлика руля, Полный электропак…",8000,2015,Карши
Chevrolet Damas,"Торг есть 2021г., Газ-бензин, 20 000 км, Седан, КПП Механика, Аудиосистема, Radnoy toza kiraska kiriditi bor murojat uchun tel",5525,2021,Навои
Chevrolet Damas,"2011г., Газ-бензин, 400 000 км, Белый, Универсал, КПП Механика, Краска тоза мос жим каропка мотор зор чехол полик яхши балонла…",5700,2011,Фергана
ВАЗ (Lada) Largus,"Торг есть 2014г., 1.6 л, Газ-бензин, 429 000 км, Белый, Универсал, КПП Механика, Аудиосистема, ABS, Подушка безопасности, Техосмотр прой…",9500,2014,Сырдарья
"Chevrolet Spark, 4 позиция","2018г., 1.3 л, Газ-бензин, 102 000 км, Хэтчбек, КПП Автомат, Литые диски, Противотуманки, Аудиосистема, Гидравлика руля, ABS,…",8100,2018,Ташкент
"Chevrolet Nexia 2, 4 позиция DOHC","Торг есть 2010г., 1.6 л, Газ-бензин, 280 000 км, Седан, КПП Механика, Противотуманки, Аудиосистема, Гидравлика руля, Полный электропакет…",5600,2010,Ташкент
"Chevrolet Nexia 3, 2 позиция","Торг есть 2018г., 1.5 л, Бензин, 22 000 км, Белый, Седан, КПП Механика, Ветровики, Дневные ходовые огни, Противотуманки, Обогрев зеркал,…",8700,2018,Ташкент
"Chevrolet Matiz, 3 позиция","Торг есть 2005г., 0.8 л, Газ-бензин, 254 823 км, Хэтчбек, КПП Механика, Аудиосистема, Кондиционер, Mator hadavoy qilingan zor iwi yo'q t…",3500,2005,Ташкент
"Chevrolet Cobalt, 2 позиция","2018г., 1.5 л, Газ-бензин, 148 км, Белый, Седан, КПП Механика, Противотуманки, Обогрев зеркал, Аудиосистема, ABS, Подушка безо…",9200,2018,Джизак
"Chevrolet Lacetti, 1 позиция","Торг есть 2013г., 1.8 л, Газ-бензин, 91 800 км, Серый, Седан, КПП Механика, Обогрев зеркал, Аудиосистема, Гидравлика руля, ABS, Полный э…",8500,2013,Карши
Chevrolet Damas,"Есть доставка 2021г., 0.8 л, Бензин, Универсал, КПП Механика, MP3, DVD, Bluetooth, Аудиосистема, USB, Машина идеальная, 1 владелец, любая пр…",7900,2021,Ташкент
Chevrolet Damas,"Есть доставка 2021г., 0.8 л, Бензин, Универсал, КПП Механика, MP3, DVD, Bluetooth, Аудиосистема, USB, Машина идеальная, 1 владелец, любая пр…",7900,2021,Ташкент
"Chevrolet Lacetti, 1 позиция","Торг есть 2017г., 1.5 л, Газ-бензин, 87 000 км, Белый, Седан, КПП Механика, Литые диски, Тонировка, Обогрев зеркал, CD-чейнджер, Встроен…",10800,2017,Самарканд
"Chevrolet Nexia 2, 4 позиция SOHC","Торг есть 2015г., 1.5 л, Бензин, Седан, КПП Механика, Противотуманки, Аудиосистема, Гидравлика руля, Центрозамок, Кондиционер, Полный эл…",6600,2015,Самарканд
ВАЗ (Lada) 2106,"1974г., Газ-бензин, 658 956 км, Белый, Седан, КПП Механика, Машина нахаду",1105,1974,Кувинский район
"Chevrolet Nexia 2, 1 позиция SOHC","2014г., 1.5 л, Газ-бензин, 50 000 км, Седан, КПП Механика, Аудиосистема, Bitta eshikda bor",6906,2014,Чиракчинский район
Chevrolet Damas,"Есть доставка 2021г., 0.8 л, Бензин, Белый, Универсал, КПП Механика, Аудиосистема, DVD, Bluetooth, MP3, USB, Не битая, не крашенная, сел пое…",7700,2021,Ташкент
ВАЗ (Lada) 2107,"Торг есть 1996г., 1.6 л, Газ-бензин, 10 000 км, Седан, КПП Механика",2500,1996,Бухара
"Chevrolet Cobalt, 2 позиция","Торг есть 2013г., 1.5 л, Газ-бензин, 400 км, Седан, КПП Механика, Ксенон, Противотуманки, Обогрев зеркал, Аудиосистема, CD, CD-чейнджер,…",8800,2013,Джизак
"Chevrolet Captiva, 4 позиция","Торг есть 2015г., 3 л, Бензин, Кроссовер, КПП Автомат, Люк, Рейлинги, Литые диски, Панорамная крыша, Дневные ходовые огни, Противотуманк…",20500,2015,Шерабадский район
ВАЗ (Lada) 2102,"Торг есть 1971г., Газ-бензин, 500 000 км, Универсал, КПП Механика, Vaz 2102 mator 03 salon bilan kuzibga ozgina ishi bor moshitni olgan…",1381,1971,Карши
"Chevrolet Cobalt, 4 позиция","Торг есть 2021г., 1.5 л, Бензин, 2 300 км, Мокрый асфальт, Седан, КПП Автомат, Литые диски, Люк, Рейлинги, Противотуманки, Обогрев зерка…",12400,2021,Ташкент
ВАЗ (Lada) Нива,"1986г., Газ-бензин, Оранжевый, Внедорожник, КПП Механика, Техосмотр пройден, Вложений не требует, Балонлар йанги матор хадавой…",3000,1986,Самарканд
"Chevrolet Lacetti, 1 позиция","Торг есть 2015г., 1.5 л, Газ-бензин, 101 000 км, Седан, КПП Механика, Противотуманки, Обогрев зеркал, Велюр, Аудиосистема, CD, USB, Гидр…",9900,2015,Самарканд
Daewoo Nexia,"Торг есть 2007г., 1.5 л, Газ-бензин, 125 000 км, Белый, Седан, КПП Механика, Противотуманки, Аудиосистема, Встроенный телефон, CD, USB,…",4800,2007,Ургенчский район
"Chevrolet Spark, 2 позиция","Торг есть 2012г., 1.1 л, Газ-бензин, 335 500 км, Жёлто-зеленый, Хэтчбек, КПП Механика, Противотуманки, Аудиосистема, USB, Гидравлика рул…",7827,2012,Нукусский район
Daewoo Labo,"1996г., 0.9 л, Газ, 98 000 км, Внедорожник, КПП Механика, Мошинани хамма запчасини янги куйилган 4 та балон янги юмшог балон А…",5600,1996,Андижан
"Chevrolet Cobalt, 2 позиция","2020г., 1.5 л, Бензин, 20 000 км, Седан, КПП Механика, Противотуманки, Обогрев зеркал, Аудиосистема, ABS, Подушка безопасности…",10681,2020,Ургенч
"Chevrolet Lacetti, 2 позиция","Торг есть 2011г., 1.8 л, Газ-бензин, 163 000 км, Седан, КПП Механика, Тонировка, Противотуманки, Обогрев зеркал, Велюр, Аудиосистема, Ги…",6906,2011,Кошкупырский район
"Chevrolet Spark, 4 позиция","Торг есть 2021г., 1.3 л, Бензин, 18 000 км, Перламутрово-коричневый, Хэтчбек, КПП Автомат, Литые диски, Противотуманки, Аудиосистема, Ги…",9500,2021,Ташкент
Daewoo Nexia,"Торг есть 1996г., 1.5 л, Бензин, 331 476 км, Седан, КПП Механика, Литые диски, Ветровики, Противотуманки, Комбинированный, Шторки, Аудио…",4200,1996,Ташкент
Daewoo Nexia,"Торг есть 1996г., 1.5 л, Бензин, 331 476 км, Седан, КПП Механика, Литые диски, Ветровики, Противотуманки, Комбинированный, Шторки, Аудио…",4200,1996,Ташкент
ВАЗ (Lada) 2107,"Торг есть 1987г., Газ-бензин, 111 111 км, Белый, Седан, КПП Механика, Фаркоп, Ксенон, Дневные ходовые огни, Противотуманки, Шторки, Ауди…",2486,1987,Беруни
"Chevrolet Malibu, 2 позиция","2013г., 2.4 л, Газ-бензин, 107 000 км, Белый, Седан, КПП Механика, Литые диски, Люк, Противотуманки, Обогрев зеркал, Аудиосист…",14000,2013,Андижан
Daewoo Nexia II,"2009г., 1.5 л, Газ-бензин, Седан, КПП Механика, Аудиосистема, Тел килинглар гаплашамиш нархини келишамиз",5064,2009,Джизак
Москвич АЗЛК 2140,"Торг есть 1982г., Газ-бензин, 120 000 км, Зеленый, Седан, КПП Механика, Avtomobil tòliq radnoy. Metan gaz 75 òrnatilgan",1381,1982,Бухара
"Chevrolet Malibu, 2 позиция","2019г., 2.4 л, Бензин, 41 000 км, Седан, КПП Механика, Литые диски, Люк, Противотуманки, Обогрев зеркал, Аудиосистема, Гидравл…",23500,2019,Наманган
Kia Carnival,"Есть доставкаТорг есть 2008г., Газ-бензин, 3 000 км, Внедорожник, КПП Автомат, Машинада айб йук кираскаси Тоза",13000,2008,Навои
"Chevrolet Nexia 2, 4 позиция DOHC","2014г., 1.6 л, Бензин, 77 100 км, Седан, КПП Механика, Противотуманки, Аудиосистема, Гидравлика руля, Полный электропакет, Цен…",6800,2014,Алмалык
Daewoo Labo,"Торг есть 2012г., Газ, 324 237 км, Универсал, КПП Механика, Labo kares rama butun gozal xolata zavatiskoy gaz pirapan metan",8050,2012,Избасканский район
"Chevrolet Nexia 2, 2 позиция DOHC","Торг есть 2014г., 1.6 л, Газ-бензин, 144 000 км, Белый, Седан, КПП Механика, Аудиосистема, Гидравлика руля, Центрозамок, Кондиционер, Те…",5985,2014,Ханкинский район
Chevrolet Nexia 2,"2015г., 1.5 л, Газ-бензин, 156 000 км, Седан, КПП Механика, Аудиосистема, CD, MP3, USB, Сабвуфер, Гидравлика руля, Сигнализаци…",6500,2015,Багдадский район
Chevrolet Damas,"Торг есть 1997г., Газ-бензин, 222 225 км, Фургон, КПП Механика, Bluetooth, MP3, USB, Yaxshi",3000,1997,Навои
"Chevrolet Matiz, 2 позиция","Торг есть 2014г., 0.8 л, Бензин, 154 000 км, Белый, Хэтчбек, КПП Механика, Аудиосистема, Гидравлика руля, Центрозамок, Сигнализация, Авт…",4700,2014,Ташкент
ВАЗ (Lada) Granta,"Торг есть 2014г., 1.5 л, Газ-бензин, 100 000 км, Черный, Седан, КПП Механика, Аудиосистема, Встроенный телефон, Bluetooth, CD, CD-чейндж…",5000,2014,Коканд
"Chevrolet Matiz Best, 2 позиция","2009г., 1 л, Газ-бензин, 490 000 км, Жёлтый, Хэтчбек, КПП Механика, Противотуманки, Велюр, Аудиосистема, Сигнализация, Центроз…",3000,2009,Андижан
Chevrolet Niva,"2005г., Газ-бензин, 112 213 км, Серебристый, Внедорожник, КПП Механика, Встроенный телефон, Bluetooth, MP3, USB, Зимний режим,…",4604,2005,Самарканд
Chevrolet Niva,"2005г., 2 л, Газ-бензин, 112 213 км, Серебристый, Внедорожник, КПП Механика, Встроенный телефон, Bluetooth, MP3, USB",4604,2005,Самарканд
Daewoo Damas,"Торг есть 1999г., Газ-бензин, Красный, КПП Механика",3223,1999,Самарканд
Daewoo Damas,"Торг есть 1999г., Газ-бензин, Красный, КПП Механика",3223,1999,Навои
"Chevrolet Nexia 2, 1 позиция SOHC","2016г., 1.5 л, Бензин, 75 км, Седан, КПП Механика, Кожа, Аудиосистема, Toza",7366,2016,Джизак
ВАЗ (Lada) 2101,"Есть доставкаТорг есть 1979г., Газ-бензин, Сахара, Седан, КПП Механика, Литые диски, Дневные ходовые огни, Комбинированный, Аудиосистема, Qilish kere…",1500,1979,Ташкент
Daewoo Nexia,"Торг есть 1997г., Газ-бензин, Белый, Седан, КПП Механика",3500,1997,Наманган
"Chevrolet Lacetti, 3 позиция","Торг есть 2009г., 1.8 л, Газ-бензин, 35 000 км, Седан, КПП Автомат, Литые диски, Люк, Панорамная крыша, Фаркоп, Противотуманки, Обогрев…",8287,2009,Багатский район
"Chevrolet Lacetti, 2 позиция","2011г., 1.8 л, Газ-бензин, 200 000 км, Белый, Седан, КПП Механика, Противотуманки, Обогрев зеркал, Аудиосистема, Гидравлика ру…",7800,2011,Шахрисабзский район
Ford Transit,"Торг есть 1992г., Дизель, Фургон, КПП Механика, 4 ta Ballon yangi akumlyatir yangi Yurub turgan moshin",5500,1992,Карши
"Chevrolet Cobalt, 4 евро позиция","Торг есть 2022г., 1.5 л, Бензин, 9 км, Белый, Седан, КПП Автомат, Литые диски, Люк, Рейлинги, Противотуманки, Обогрев зеркал, Аудиосисте…",13000,2022,Карши
Daewoo Tico,"Торг есть 1996г., Бензин, 260 556 км, Жёлтый, Хэтчбек, КПП Автомат, Литые диски, Ксенон, Корректор фар, Велюр, Аудиосистема, CD, USB, Бе…",2394,1996,Джизак
ВАЗ (Lada) 2106,"1988г., Газ-бензин, Молочный цвет, Седан, КПП Механика, Dvigatel raqamsiz benzin metan",1659,1988,Кумкурганский район
Daewoo Matiz (Standart),"Торг есть 2009г., 2 л, Бензин, 160 000 км, Седан, КПП Механика, Велюр, Аудиосистема, CD-чейнджер, Гидравлика руля, Техосмотр пройден, Вл…",3700,2009,Карши
"Chevrolet Lacetti, 3 позиция","2022г., 1.6 л, Газ-бензин, 1 000 км, Белый, Седан, КПП Автомат, Литые диски, Люк, Противотуманки, Обогрев зеркал, Аудиосистема…",16500,2022,Фергана
"Chevrolet Lacetti, 2 позиция","2009г., 1.8 л, Газ-бензин, 220 000 км, Серебристый, Седан, КПП Механика, Противотуманки, Обогрев зеркал, Шторки, Аудиосистема,…",7700,2009,Ташкент
ВАЗ (Lada) 2106,"Торг есть 1988г., Газ-бензин, Молочный цвет, Седан, КПП Механика, Dvigatel raqamsiz benzin metan",1659,1988,Кумкурганский район
Daewoo Nexia,"Торг есть 2006г., 1.6 л, Газ-бензин, Хэтчбек, КПП Механика",3700,2006,Андижан
"Chevrolet Lacetti, 1 позиция","Торг есть 2012г., 1.8 л, Бензин, 137 000 км, Седан, КПП Механика, Обогрев зеркал, Комбинированный, Аудиосистема, DVD-чейнджер, Гидравлик…",8100,2012,Ташкент
Daewoo Tico,"Торг есть 1998г., Газ-бензин, 258 000 км, Красный, Седан, КПП Механика",2762,1998,Самарканд
Mercedes-Benz 190,"Есть доставкаТорг есть 1990г., Газ-бензин, 500 км, Серебристый, Седан, КПП Механика, Chaqasi bor",3200,1990,Ташкент
"Chevrolet Matiz, 1 позиция","Торг есть 2014г., 0.8 л, Газ-бензин, 2 000 км, Жёлтый, Хэтчбек, КПП Механика, Спойлер, Биксенон, Велюр, Аудиосистема, Бесключевой доступ…",4000,2014,Навои
