Title,Description,Price,Manufactured Year,Region
Москвич АЗЛК 2140,"Торг есть 1981г., 1.5 л, Бензин, Бежевый, Седан, КПП Механика",1842,1981,Ташкент
Daewoo Labo,"Торг есть 2002г., Газ, Пикап, КПП Механика",5800,2002,Ташкент
"Chevrolet Cobalt, 2 позиция","2021г., 1.5 л, Бензин, 5 400 км, Седан, КПП Механика, Противотуманки, Обогрев зеркал, Аудиосистема, ABS, Подушка безопасности,…",11800,2021,Бухара
"Chevrolet Cobalt, 2 позиция","Торг есть 2019г., 1.5 л, Бензин, 39 000 км, Седан, КПП Механика, Противотуманки, Обогрев зеркал, MP3, Аудиосистема, CD, Кондиционер, Под…",9650,2019,Ташкент
"Chevrolet Spark, 2 позиция","2019г., 1.3 л, Бензин, 14 000 км, Хэтчбек, КПП Механика, Противотуманки, Аудиосистема, Гидравлика руля, Подушка безопасности,…",8000,2019,Ташкент
"Chevrolet Cobalt, 4 позиция","2020г., 1.6 л, Бензин, 15 000 км, Коричневый, Седан, КПП Автомат, Литые диски, Люк, Рейлинги, Противотуманки, Обогрев зеркал,…",12850,2020,Янгиарыкский район
Daewoo Tico,"Торг есть 1998г., Бензин, Мокрый асфальт, Хэтчбек, КПП Механика, Navorotlari bor mator yoğ yemidi",1565,1998,Самарканд
Chevrolet Damas,"Есть доставкаТорг есть 2021г., 1 л, Газ-бензин, 17 500 км, Белый, Седан, КПП Механика, Фаркоп, Литые диски, Панорамная крыша, Тонировка, Люк, Кенгуря…",8500,2021,Карши
"Chevrolet Matiz, 1 позиция","Торг есть 2008г., 0.8 л, Газ-бензин, 15 000 км, Белый, Хэтчбек, КПП Механика, Литые диски, Биксенон, Велюр, Аудиосистема, Сигнализация,…",2302,2008,Навои
ВАЗ (Lada) 2106,"1978г., Газ-бензин, Седан, КПП Механика, Kaprimont bogan hamayohi",2762,1978,Ташкент
ВАЗ (Lada) 2107,"1993г., Газ, Мокрый асфальт, Седан, КПП Механика, Moshina xolati yaxshi",2302,1993,Андижан
"Chevrolet Lacetti, 3 позиция","Торг есть 2013г., 1.6 л, Бензин, 140 000 км, Седан, КПП Автомат, Литые диски, Люк, Противотуманки, Обогрев зеркал, Алькантара, Аудиосист…",9300,2013,Ташкент
Mercedes-Benz C 200,"Торг есть 2001г., Бензин, 103 000 км, Черный, Хэтчбек, КПП Автомат, Тонировка, Кожа, Техосмотр пройден, Вложений не требует, Toza kirask…",10000,2001,Ташкент
"Chevrolet Nexia 2, 4 позиция DOHC","Торг есть 2016г., 1.6 л, Бензин, Седан, КПП Механика, Литые диски, Противотуманки, Дневные ходовые огни, Велюр, Кожа, CD-чейнджер, MP3,…",7900,2016,Ташкент
ГАЗ 2410 (Волга),"1990г., Газ-бензин, Седан, КПП Механика, Гидравлик руль полни ремонт буган 5талик каробка ками йок",3000,1990,Каракульский район
ВАЗ (Lada) Vesta Sport,"2021г., Бензин, 16 000 км, Черный, Хэтчбек, КПП Автомат, Литые диски, Тонировка, Кожа, Bluetooth, MP3, USB, Гидравлика руля, С…",18000,2021,Бухара
Chevrolet Damas,"Торг есть 2020г., Бензин, 5 000 км, Белый, Седан, КПП Механика, Toza moshina bir qo'l",8000,2020,Ташкент
Москвич 412,"Торг есть 1990г., Газ-бензин, 1 217 км, Седан, КПП Механика, Yaxshi zo r",1500,1990,Фергана
ГАЗ 2410 (Волга),"Торг есть 1980г., Газ-бензин, 300 000 км, Универсал, КПП Механика, Кожа, Аудиосистема, Техосмотр пройден, Вложений не требует, Rabochiy…",3500,1980,Ташкент
Daewoo Tico,"Есть доставкаТорг есть 2001г., 1 л, Бензин, 124 446 км, Хэтчбек, КПП Механика, Литые диски, Тонировка, Обогрев зеркал, Велюр, Кожа, Комбинированный,…",2947,2001,Янгиарыкский район
ВАЗ (Lada) 2104,"Торг есть 1992г., 1.3 л, Газ-бензин, Хэтчбек, КПП Механика, Moshin tayyor bez xarajot mator karopka xadavoy chotki",2900,1992,Самарканд
"Chevrolet Captiva, 4 позиция","2017г., 3 л, Бензин, 36 км, Черный, Кроссовер, КПП Автомат, Литые диски, Люк, Рейлинги, Обогрев зеркал, Противотуманки, Аудиос…",26774,2017,Ташкент
Daewoo Matiz (Standart),"Торг есть 2006г., Бензин, 315 000 км, Серый, Хэтчбек, КПП Механика, Гидравлика руля, Центрозамок, Техосмотр пройден, Урилмалан суяги бут…",3400,2006,Алмалык
Chevrolet Damas,"Торг есть 2021г., 1.3 л, Газ-бензин, 1 500 км, Молочный цвет, Седан, КПП Механика, Hali yangi 1500ta yurgan xolos",8800,2021,Бухара
"Chevrolet Nexia 2, 2 позиция SOHC","Торг есть 2010г., 1.5 л, Газ-бензин, 480 000 км, Седан, КПП Механика, Аудиосистема, MP3, Гидравлика руля",5200,2010,Джизак
Daewoo Tico,"1997г., Бензин, 32 662 км, Универсал, КПП Механика, Кожа, Bluetooth, Bi xarajat",2000,1997,Карши
Geely Emgrand EV500,"2019г., 2 л, Электричество, 15 000 км, Белый, Седан, КПП Автомат, Литые диски, Кожа, Аудиосистема, Встроенный телефон, Bluetoo…",25000,2019,Ташкент
"Chevrolet Captiva, 1 позиция","Торг есть 2010г., 3.2 л, Газ-бензин, 93 000 км, Кроссовер, КПП Автомат, Литые диски, Люк, Противотуманки, Обогрев зеркал, Кожа, Аудиосис…",12000,2010,Бухара
Hyundai Starex,"Торг есть 2013г., 2.4 л, Дизель, 313 000 км, Минивэн, КПП Автомат, Литые диски, Кожа, Аудиосистема, Bluetooth, CD, MP3, USB, Гидравлика…",14800,2013,Кувасай
"Chevrolet Captiva, 4 позиция","Торг есть 2018г., 2.4 л, Бензин, 11 000 км, Черный, Внедорожник, КПП Автомат, Литые диски, Люк, Рейлинги, Противотуманки, Обогрев зеркал…",31000,2018,Коканд
Chevrolet Damas,"Торг есть 2013г., 1.2 л, Газ-бензин, 320 000 км, Молочный цвет, Седан, КПП Механика, Шторки, Mashina most karobka motor zor",6000,2013,Асакинский район
Mercedes-Benz 190,"1985г., 2 л, Бензин, Зеленый, Седан, КПП Механика, Литые диски, Люк, Спойлер, Обвес, Аудиосистема, Сабвуфер, Гидравлика руля,…",4500,1985,Ташкент
"Chevrolet Orlando, 2 позиция","2016г., Бензин, 1 000 км, Черный, Минивэн, КПП Механика, Люк, Аудиосистема, Кондиционер, Климат-контроль, Круиз-контроль, Парк…",22000,2016,Бухара
"Chevrolet Spark, 3 позиция","Торг есть 2016г., 1.3 л, Бензин, 112 000 км, Хэтчбек, КПП Автомат, Литые диски, Рейлинги, Противотуманки, Комбинированный, Шторки, Аудио…",8000,2016,Ташкент
Chevrolet Damas,"2019г., Газ-бензин, 32 600 км, Белый, Универсал, КПП Механика, Противотуманки, Сигнализация, Центрозамок, Техосмотр пройден, В…",8000,2019,Самарканд
Kia Bongo,"2004г., Газ, 601 136 км, Белый, Седан, КПП Механика, Yangi mator qilindi hech qanday rashod yoq ishga tayor balonlari mos karo…",9000,2004,Наманган
Daewoo Nexia,"Торг есть 2001г., Газ-бензин, 374 413 км, Седан, КПП Механика, 4-balon yangi polik tashalgan chihol bor pult shumka qilingan ozgina petn…",5000,2001,Самарканд
"Chevrolet Malibu, 3 позиция","Торг есть 2017г., 1.5 л, Бензин, 92 617 км, Седан, КПП Автомат, Литые диски, Багажник, Фаркоп, Противотуманки, Обогрев зеркал, Кожа, Ком…",22500,2017,Булакбашинский район
Chevrolet Damas,"2020г., 1.2 л, Бензин, 6 800 км, Минивэн, КПП Механика, Техосмотр пройден, Вложений не требует, Urilmgan toza",8000,2020,Ташкент
Daewoo Matiz Creative,"2005г., Газ, 257 694 км, Седан, КПП Механика, Гидравлика руля, Выкуп фак, ат Навоий вилоятига",2947,2005,Навои
ВАЗ (Lada) 2102,"Есть доставкаТорг есть 1985г., 1 л, Газ, Белый, Фургон, КПП Механика, Техосмотр пройден, Вложений не требует",2302,1985,Денау
"Chevrolet Lacetti, 1 позиция","2017г., 1.5 л, Бензин, 150 км, Мокрый асфальт, Седан, КПП Автомат, Обогрев зеркал, MP3, Аудиосистема, CD, Кондиционер, Центроз…",12000,2017,Ташкент
Chevrolet Matiz,"2008г., Бензин, 270 000 км, Седан, КПП Механика, Bluetooth, MP3",3200,2008,Самарканд
Daewoo Damas,"1996г., Газ-бензин, 99 999 км, Белый, Седан, КПП Механика",2578,1996,Шерабадский район
Daewoo Nexia,"Торг есть 1998г., Газ, 409 753 км, Белый, Седан, КПП Механика",3683,1998,Джизак
ВАЗ (Lada) 2107,"2007г., Газ-бензин, Седан, КПП Механика",4000,2007,Паркентский район
Daewoo Nexia,"1996г., 1.5 л, Газ-бензин, 570 000 км, Серый, КПП Механика, Литые диски, Шторки, CD, MP3, Bluetooth, Центрозамок, Сигнализация…",4100,1996,Ташкент
"Chevrolet Matiz, 2 позиция","Торг есть 2014г., 0.8 л, Бензин, 69 262 км, Серебристый, Хэтчбек, КПП Механика, Аудиосистема, Техосмотр пройден, Hamma malumotlar telefo…",4600,2014,Ташкент
"Chevrolet Nexia 3, 4 позиция","Торг есть 2018г., 1.5 л, Бензин, 66 000 км, Перламутрово-коричневый, Седан, КПП Автомат, Литые диски, Противотуманки, Обогрев зеркал, Ве…",9200,2018,Ташкент
"Chevrolet Cobalt, 2 позиция","Торг есть 2019г., 1.5 л, Бензин, 76 000 км, Седан, КПП Механика, Противотуманки, Обогрев зеркал, Аудиосистема, ABS, Подушка безопасности…",10589,2019,Ургенч
ГАЗ 3302 (ГАЗель Бизнес),"Есть доставкаТорг есть 2013г., 2 л, Газ-бензин, 180 000 км, Микроавтобус, КПП Механика, MP3, USB, 6 balon yangi, motor qilingan, akumlyator yangi, me…",8000,2013,Самарканд
"Chevrolet Spark, 4 позиция","Торг есть 2022г., 1.3 л, Бензин, Белый, Хэтчбек, КПП Механика, Литые диски, Противотуманки, Аудиосистема, Центрозамок, Подушка безопасно…",10250,2022,Ташкент
"Chevrolet Nexia 2, 3 позиция SOHC","2014г., 1.5 л, Бензин, 87 325 км, Седан, КПП Механика, Багажник, Дневные ходовые огни, Противотуманки, Обогрев зеркал, Кожа, А…",7366,2014,Термез
"Chevrolet Nexia 2, 4 позиция SOHC","2015г., 1.6 л, Газ-бензин, 44 000 км, Белый, Седан, КПП Механика, Противотуманки, Велюр, Аудиосистема, Гидравлика руля, Полный…",7200,2015,Джизак
Chevrolet Spark,"Торг есть 2014г., Газ-бензин, 68 000 км, Синий, Хэтчбек, КПП Автомат, Spark 2014 год. Евро позиция. Автомат каробка. Установлен газ проп…",6000,2014,Самарканд
"Chevrolet Matiz, 2 позиция","Торг есть 2013г., 0.8 л, Газ-бензин, 269 000 км, Хэтчбек, КПП Механика, Литые диски, Тонировка, Противотуманки, Велюр, Аудиосистема, CD-…",4350,2013,Термез
ВАЗ (Lada) Нива,"Есть доставкаТорг есть 1988г., 1.6 л, Газ-бензин, 140 000 км, Серебристый, Универсал, КПП Механика, Литые диски, Ветровики, Комбинированный, MP3, USB…",4700,1988,Алмалык
"Chevrolet Nexia 2, 2 позиция SOHC","Торг есть 2009г., 1.5 л, Газ-бензин, 317 129 км, Серый, Седан, КПП Механика, Велюр, Аудиосистема, Встроенный телефон, CD-чейнджер, MP3,…",5500,2009,Музрабадский район
Daewoo Nexia II,"2013г., 1.5 л, Газ-бензин, 11 800 км, Седан, КПП Механика, Литые диски, Кожа, Мошина 1 ку'л капот у'н кирило алмашган 11800 юр…",6000,2013,Чирчик
"Chevrolet Nexia 2, 1 позиция DOHC","Торг есть 2010г., 1.6 л, Газ-бензин, 189 000 км, Белый, Седан, КПП Механика, Аудиосистема, Yaxshi",5000,2010,Джизак
"Chevrolet Captiva, 4 позиция","Торг есть 2008г., 3.2 л, Газ-бензин, 340 000 км, Кроссовер, КПП Автомат, Литые диски, Люк, Рейлинги, Багажник, Линзованная оптика, Проти…",12000,2008,Шаватский район
"Chevrolet Cobalt, 4 евро позиция","2022г., 1.5 л, Бензин, 11 500 км, Седан, КПП Автомат, Литые диски, Люк, Рейлинги, Противотуманки, Обогрев зеркал, Аудиосистема…",13000,2022,Самарканд
ВАЗ (Lada) 2106,"1988г., Газ, Седан, КПП Механика, Техосмотр пройден, Вложений не требует, Матор 03 якинда килинди маторга жавоб 1200 — дан кам…",1200,1988,Баяутский район
Chevrolet Matiz,"Торг есть 2010г., 1 л, Газ-бензин, 490 000 км, Жёлтый, Хэтчбек, КПП Механика, Обогрев зеркал, MP3, Гидравлика руля, Sariq Matiz best 201…",3683,2010,Навои
"Chevrolet Lacetti, 3 позиция","2013г., 1.6 л, Газ-бензин, 120 000 км, Седан, КПП Автомат, Литые диски, Люк, Противотуманки, Обогрев зеркал, Аудиосистема, Гид…",8600,2013,Наманган
Daewoo Gentra,"2016г., 1.5 л, Газ-бензин, 200 км, Дельфин, Седан, КПП Автомат, Обвес, Багажник, Кожа, Аудиосистема, Вложений не требует, Uril…",12000,2016,Ташкент
Mercedes-Benz S 320,"Торг есть 1987г., 3.2 л, Бензин, 260 000 км, Седан, КПП Автомат, Литые диски, Тонировка, Люк, Обвес, Кожа, Дерево, Аудиосистема, CD, DVD…",5500,1987,Ташкент
"Chevrolet Lacetti, 1 позиция","Торг есть 2020г., 1.5 л, Бензин, 46 000 км, Седан, КПП Механика, Обогрев зеркал, Аудиосистема, Bluetooth, MP3, USB, Гидравлика руля, ABS…",12500,2020,Ташкент
"Chevrolet Matiz, 2 позиция","Торг есть 2016г., 0.8 л, Газ-бензин, 269 000 км, Хэтчбек, КПП Механика, Тонировка, Дневные ходовые огни, Противотуманки, Велюр, Аудиосис…",4350,2016,Термез
Москвич 412,"Торг есть 1984г., Газ, Белый, Седан, КПП Механика",1105,1984,Шахриханский район
Mercedes-Benz Vito,"Торг есть 2015г., Дизель, 137 400 км, Минивэн, КПП Механика, Аудиосистема, Встроенный телефон, Bluetooth, CD, MP3, USB",27000,2015,Ташкент
ВАЗ (Lada) Priora,"2008г., Бензин, 300 км, Серый, Седан, КПП Механика, CD, Урилмаган краска тоза уйга минилган",3959,2008,Нукус
Daewoo Matiz (Standart),"Торг есть 2004г., Газ-бензин, 350 000 км, Белый, Седан, КПП Механика, Велюр, Гидравлика руля, Техосмотр пройден, Вложений не требует",3500,2004,Наманган
ВАЗ (Lada) Priora,"2008г., Бензин, 300 км, Серый, Седан, КПП Механика, CD, Урилмаган краска тоза уйга минилган",3959,2008,Нукус
Daewoo Matiz (Standart),"Торг есть 2004г., Газ-бензин, 350 000 км, Белый, Седан, КПП Механика, Велюр, Гидравлика руля, Техосмотр пройден, Вложений не требует",3500,2004,Наманган
"Chevrolet Spark, 3 позиция","Торг есть 2014г., 1.2 л, Газ-бензин, 167 000 км, Белый, Хэтчбек, КПП Механика, Рейлинги, Противотуманки, Велюр, Аудиосистема, Гидравлика…",6500,2014,Ташкент
"Chevrolet Spark, 2 позиция","Торг есть 2015г., 1.3 л, Газ-бензин, Хэтчбек, КПП Механика, Литые диски, Спойлер, Обвес, Ксенон, Дневные ходовые огни, Противотуманки, А…",7000,2015,Ташкент
"Chevrolet Cobalt, 2 евро позиция","2014г., 1.6 л, Газ-бензин, 361 000 км, Седан, КПП Механика, Литые диски, Противотуманки, Обогрев зеркал, Аудиосистема, Гидравл…",8000,2014,Фергана
"Chevrolet Spark, 2 евро позиция","Торг есть 2019г., 1.3 л, Бензин, 22 000 км, Белый, Хэтчбек, КПП Механика, Багажник, Противотуманки, Аудиосистема, Гидравлика руля, ABS,…",7700,2019,Самарканд
Daewoo Tico,"Торг есть 2002г., Бензин, 137 000 км, Молочный цвет, Внедорожник, КПП Механика, Аудиосистема, Встроенный телефон, MP3, USB, Idial xolata",2500,2002,Самарканд
ВАЗ (Lada) Самара 2 (седан 2115),"2003г., 1.5 л, Газ-бензин, 289 000 км, Бронза, Седан, КПП Механика, Велюр, Сигнализация, Техосмотр пройден, Мошина нахаду сост…",3300,2003,Ташкент
"Chevrolet Spark, 2 позиция","2017г., 1.3 л, Газ-бензин, 200 км, Белый, Хэтчбек, КПП Механика, Противотуманки, Аудиосистема, Гидравлика руля, ABS, Подушка б…",7000,2017,Фергана
"Chevrolet Spark, 2 позиция","2012г., 1.4 л, Бензин, 2 000 км, Зеленый, Хэтчбек, КПП Механика, Противотуманки, Аудиосистема, Гидравлика руля, ABS, Подушка б…",5064,2012,Навои
"Chevrolet Spark, 2 евро позиция","Торг есть 2020г., 1.3 л, Бензин, 39 050 км, Белый, Хэтчбек, КПП Механика, Противотуманки, Аудиосистема, Гидравлика руля, ABS, Подушка бе…",7800,2020,Коканд
ВАЗ (Lada) 2107,"Торг есть 1985г., 1.3 л, Газ-бензин, Белый, Седан, КПП Механика, Литые диски, Тонировка, Противотуманки, Велюр, Аудиосистема, MP3, USB,…",2000,1985,Ташкент
"Chevrolet Lacetti, 3 позиция","Есть доставкаТорг есть 2018г., 1.5 л, Бензин, 4 800 км, Белый, Седан, КПП Автомат, Люк, Литые диски, Обогрев зеркал, Противотуманки, Велюр, Аудиосист…",14000,2018,Ташкент
"Chevrolet Lacetti, 3 позиция","2021г., 1.6 л, Бензин, 13 000 км, Седан, КПП Автомат, Литые диски, Люк, Противотуманки, Обогрев зеркал, Аудиосистема, Гидравли…",15650,2021,Джизак
"Chevrolet Lacetti, 3 позиция","2021г., 1.6 л, Газ-бензин, 12 000 км, Белый, Седан, КПП Автомат, Литые диски, Люк, Противотуманки, Обогрев зеркал, Аудиосистем…",15500,2021,Джизак
ВАЗ (Lada) 2102,"1982г., Газ, Хэтчбек, КПП Механика, Qilingan moshin",1657,1982,Карши
"Chevrolet Matiz, 1 позиция","2017г., 0.8 л, Бензин, 144 000 км, Хэтчбек, КПП Механика, Аудиосистема, Техосмотр пройден, Вложений не требует, Moshinani sast…",5700,2017,Джизак
"Chevrolet Lacetti, 3 позиция","Есть доставка 2021г., 1.6 л, Бензин, 9 000 км, Белый, Седан, КПП Автомат, Литые диски, Люк, Противотуманки, Обогрев зеркал, Аудиосистема, Ги…",16000,2021,Джизак
"Chevrolet Spark, 2 евро позиция","Есть доставка 2019г., 1.3 л, Бензин, 70 000 км, Белый, Хэтчбек, КПП Механика, Противотуманки, Аудиосистема, Гидравлика руля, ABS, Подушка бе…",8100,2019,Джизак
"Chevrolet Spark, 2 евро позиция","2019г., 1.3 л, Бензин, 70 000 км, Хэтчбек, КПП Механика, Противотуманки, Аудиосистема, Гидравлика руля, ABS, Подушка безопасно…",7500,2019,Джизак
"Chevrolet Spark, 2 евро позиция","2019г., 1.3 л, Бензин, 70 000 км, Хэтчбек, КПП Механика, Противотуманки, Аудиосистема, Гидравлика руля, ABS, Подушка безопасно…",7500,2019,Джизак
"Chevrolet Malibu, 3 позиция","2019г., 1.5 л, Бензин, 25 000 км, Белый, Седан, КПП Автомат, Литые диски, Люк, Панорамная крыша, Ксенон, Противотуманки, Обогр…",25000,2019,Джизак
ВАЗ (Lada) Kalina,"2008г., Бензин, Универсал, КПП Механика",3600,2008,Ташкент
"Chevrolet Lacetti, 3 позиция","2021г., 1.6 л, Бензин, 50 км, Седан, КПП Автомат, Литые диски, Люк, Противотуманки, Обогрев зеркал, Аудиосистема, Гидравлика р…",15500,2021,Джизак
"Chevrolet Nexia 3, 4 позиция","2021г., 1.5 л, Бензин, 10 км, Седан, КПП Автомат, Литые диски, Противотуманки, Обогрев зеркал, Аудиосистема, Гидравлика руля,…",11500,2021,Джизак
"Chevrolet Lacetti, 3 позиция","2021г., 1.6 л, Бензин, 10 км, Седан, КПП Автомат, Литые диски, Люк, Противотуманки, Обогрев зеркал, Аудиосистема, Гидравлика р…",15500,2021,Джизак
"Chevrolet Lacetti, 3 позиция","2021г., 1.6 л, Бензин, 2 500 км, Седан, КПП Автомат, Литые диски, Люк, Противотуманки, Обогрев зеркал, Аудиосистема, Гидравлик…",16000,2021,Джизак
"Chevrolet Lacetti, 3 позиция","2021г., 1.6 л, Бензин, 1 500 км, Белый, Седан, КПП Автомат, Литые диски, Люк, Противотуманки, Обогрев зеркал, Аудиосистема, Ги…",15500,2021,Джизак
