Title,Description,Price,Manufactured Year,Region
"Chevrolet Spark, 2 позиция","2014г., 1.3 л, Бензин, 230 000 км, Дельфин, Хэтчбек, КПП Механика, Противотуманки, Аудиосистема, Гидравлика руля, Подушка безо…",6500,2014,Ташкент
"Chevrolet Matiz Best, 3 позиция","2010г., Газ-бензин, 113 200 км, Хэтчбек, КПП Механика, Литые диски, Кенгурятник, Рейлинги, Противотуманки, Кожа, Комбинированн…",4236,2010,Джизак
Hyundai Starex,"2013г., 2 л, Дизель, 200 000 км, Серый, Минивэн, КПП Механика, Литые диски, Ветровики, Хрустальная оптика, Противотуманки, Обо…",15000,2013,Наманган
Москвич 2141,"1993г., 1.7 л, Бензин, Бордовый, Седан, КПП Механика, Литые диски, Велюр, Аудиосистема, Вложений не требует, Мотор усилить кли…",800,1993,Ташкент
Daewoo Damas,"Торг есть 1997г., Бензин, 150 000 км, Универсал, КПП Механика, Литые диски, Спойлер, Ветровики, Багажник, Ксенон, Дневные ходовые огни,…",3591,1997,Ташкент
ВАЗ (Lada) 2105,"1982г., Бензин, Красный, Седан, КПП Механика",1600,1982,Ташкент
Daewoo Nexia,"2001г., 1.5 л, Газ-бензин, 237 000 км, Серый, Универсал, КПП Механика, Oldi tomonida kraskasi bor",4144,2001,Байсунский район
ВАЗ (Lada) 2106,"1988г., 1.3 л, Газ-бензин, 120 000 км, Седан, КПП Механика, Литые диски, Ветровики, Багажник, Ксенон, Хрустальная оптика, Днев…",2500,1988,Ташкент
"Chevrolet Matiz, 4 позиция","2011г., 0.8 л, Газ-бензин, 300 000 км, Хэтчбек, КПП Механика, Литые диски, Рейлинги, Аудиосистема, CD, MP3, USB, Гидравлика ру…",3500,2011,Бухара
Daewoo Nexia,"Торг есть 2004г., 1.5 л, Бензин, 223 000 км, Серебристый, Седан, КПП Механика, Машина в технически исправном состоянии, особых владений…",5000,2004,Ташкент
"Chevrolet Lacetti, 1 позиция","Есть доставка 2012г., 1.8 л, Газ-бензин, 110 000 км, Белый, Седан, КПП Механика, Ветровики, Обогрев зеркал, Велюр, Шторки, Аудиосистема, Гид…",8500,2012,Навои
ВАЗ (Lada) Largus,"2013г., 1.5 л, Бензин, 175 300 км, Бежевый, Универсал, КПП Механика, Литые диски, Багажник, Хрустальная оптика, Противотуманки…",11500,2013,Джаркурганский район
УАЗ 3303,"Торг есть 1987г., 7.5 л, Газ, Зеленый, Внедорожник, КПП Механика",2000,1987,Янгикурганский район
Daewoo Damas,"Торг есть 1997г., 0.8 л, Газ-бензин, 777 777 км, Белый, Внедорожник, КПП Механика, Аудиосистема, Bluetooth, MP3, USB, Кузовыда азғана иш…",3300,1997,Ташкент
"Chevrolet Orlando, 2 позиция","2015г., Газ, 48 000 км, Минивэн, КПП Механика, Люк, Аудиосистема, Кондиционер, Климат-контроль, Круиз-контроль, Парктроники",13000,2015,Андижан
"Chevrolet Nexia 3, 3 позиция","Торг есть 2019г., 1.5 л, Газ-бензин, 109 000 км, Седан, КПП Механика, Литые диски, Противотуманки, Обогрев зеркал, Аудиосистема, Гидравл…",8932,2019,Нукус
Daewoo Damas,"Торг есть 1998г., Газ-бензин, Красный, Седан, КПП Механика, Дамас сирочни сотилади кузифда иши бор матор каропка заднимоси зур 4балони й…",2118,1998,Навои
Daewoo Tico,"Торг есть 1999г., Газ-бензин, Седан, КПП Механика",1842,1999,Нукус
ВАЗ (Lada) 2105,"Торг есть 2006г., 1.8 л, Бензин, Белый, Седан, КПП Механика, Тонировка, Литые диски, Ксенон, CD, USB, Bluetooth, MP3, Аудиосистема, Встр…",8000,2006,Ташкент
"Chevrolet Spark, 2 позиция","2019г., 1.5 л, Газ-бензин, 90 000 км, Мокрый асфальт, Хэтчбек, КПП Механика, Ксенон, Противотуманки, Аудиосистема, Гидравлика…",6906,2019,Навои
ГАЗ 31105 (Волга),"Торг есть 2007г., Газ-бензин, 175 км, Оранжевый, Седан, КПП Механика, USB, Газ прапон вариант йук Дилмурод",4500,2007,Андижан
Opel Omega,"Торг есть 1986г., 2 л, Бензин, 300 000 км, Бежевый, Седан, КПП Механика, Литые диски, Велюр, Гидравлика руля, Центрозамок, Машина мягкая…",1800,1986,Ташкент
"Chevrolet Lacetti, 1 позиция","Торг есть 2011г., 1.8 л, Газ, 450 000 км, Черный, Седан, КПП Механика, Обогрев зеркал, Аудиосистема, Bluetooth, CD, MP3, USB, Гидравлика…",6906,2011,Нукус
Chevrolet Damas,"2021г., Бензин, Седан, КПП Механика, Велюр, Аудиосистема, Встроенный телефон, Bluetooth, CD, CD-чейнджер, MP3, USB, Техосмотр…",8100,2021,Самарканд
Chevrolet Damas,"Торг есть 2017г., Газ-бензин, 162 000 км, Седан, КПП Механика, MP3, Mator xadavoy yaxwi kuzivda 3 ta petno bor",6800,2017,Ташкент
"Chevrolet Lacetti, 3 позиция","Торг есть 2011г., 1.8 л, Бензин, 200 000 км, Седан, КПП Автомат, Литые диски, Люк, Противотуманки, Обогрев зеркал, Аудиосистема, Гидравл…",8800,2011,Ташкент
ВАЗ (Lada) Kalina,"2008г., Бензин, 65 000 км, Серый, Седан, КПП Механика, Машинани холати аъло краска родной",4144,2008,Ургенч
Daewoo Damas,"Торг есть 2004г., Газ-бензин, 62 000 км, Белый, Седан, КПП Механика, Хрустальная оптика, Противотуманки, Bluetooth, USB, Вложений не тре…",5800,2004,Самарканд
"Chevrolet Nexia 3, 2 позиция","2019г., 1.5 л, Бензин, 44 000 км, Седан, КПП Механика, Противотуманки, Аудиосистема, Гидравлика руля, ABS, Подушка безопасност…",8600,2019,Бухара
"Chevrolet Spark, 3 позиция","Торг есть 2016г., 1.2 л, Бензин, 8 000 км, Белый, Хэтчбек, КПП Механика, Рейлинги, Противотуманки, Кожа, Аудиосистема, CD-чейнджер, MP3,…",7300,2016,Ташкент
"Chevrolet Lacetti, 1 позиция","2020г., 1.5 л, Бензин, 27 000 км, Белый, Седан, КПП Механика, Обогрев зеркал, Аудиосистема, Гидравлика руля, ABS, Полный элект…",12300,2020,Уртачирчикский район
Daewoo Nexia,"Торг есть 1996г., Газ, 53 000 км, Белый, Хэтчбек, КПП Механика, Иш бор озмоз",3407,1996,Самарканд
Daewoo Damas,"Торг есть 2001г., Газ-бензин, Молочный цвет, КПП Механика, Ксенон, Шторки, Кожа, Метан 65 талик кузуф 2008 кузуф алмашган дамаз 2 куйган",3750,2001,Самарканд
"Chevrolet Nexia 2, 4 позиция DOHC","2009г., 1.6 л, Газ-бензин, 300 000 км, Седан, КПП Механика, Противотуманки, Аудиосистема, Гидравлика руля, Полный электропакет…",4600,2009,Самарканд
ВАЗ (Lada) 2106,"Есть доставкаТорг есть 1985г., Газ-бензин, Белый, Седан, КПП Механика, Темир болон 80 — талик, Янги акумлятор, 4 та болон янгидай, Янги 06 матор куйи…",1850,1985,Наманган
"Chevrolet Matiz, 4 позиция","2017г., 0.8 л, Газ-бензин, 132 000 км, Хэтчбек, КПП Механика, Литые диски, Рейлинги, Аудиосистема, Кондиционер",5200,2017,Ташкент
ВАЗ (Lada) Largus,"Торг есть 2019г., Газ-бензин, 115 км, Универсал, КПП Механика",11300,2019,Самарканд
"Chevrolet Nexia 3, 2 позиция","2019г., 1.5 л, Бензин, 44 900 км, Белый, Седан, КПП Механика, Противотуманки, Аудиосистема, Гидравлика руля, ABS, Подушка безо…",8600,2019,Бухара
Daewoo Matiz Creative,"2005г., 0.8 л, Бензин, 450 000 км, Белый, Хэтчбек, КПП Механика, Аудиосистема, Встроенный телефон, CD, MP3, USB, Matiz Sotilad…",3499,2005,Кызырыкский район
ВАЗ (Lada) 2106,"Торг есть 1990г., Газ-бензин, Красный, Седан, КПП Механика, CD-чейнджер, MP3, Bluetooth, Бесключевой доступ, Центрозамок, Сигнализация,…",2302,1990,Карши
Daewoo Tico,"Торг есть 1999г., 0.8 л, Бензин, 200 000 км, Зеленый, Седан, КПП Механика, Narxini kelishamz moshina azgina qarasa yuradi boladigani min…",1500,1999,Ташкент
"Chevrolet Nexia 3, 2 позиция","Торг есть 2019г., 1.5 л, Бензин, 28 500 км, Белый, Седан, КПП Механика, Противотуманки, Шторки, Аудиосистема, Bluetooth, CD, MP3, USB, Г…",9300,2019,Навои
"Chevrolet Matiz, 1 позиция","2003г., 0.8 л, Бензин, 480 000 км, Серебристый, Хэтчбек, КПП Механика, Аудиосистема, Faqat nahtga 2000$ varyantga. Yo aybi mat…",2100,2003,Нурафшон
Москвич 412,"Торг есть 1989г., 1.5 л, Бензин, 162 016 км, Молочный цвет, Седан, КПП Механика, Пробеги родной. Уруш катншкичи булгани учун мошина куп…",1500,1989,Ташкент
Mercedes-Benz Vito,"Торг есть 2009г., 2.2 л, Дизель, Минивэн, КПП Механика",18000,2009,Ташкент
ГАЗ 21 (Волга),"Торг есть 1967г., 2.4 л, Бензин, Черный, Минивэн, КПП Механика, Toza urulmgan",3000,1967,Ташкент
УАЗ 452,"1975г., Бензин, Зеленый, КПП Механика, Xolati alo",5500,1975,Ташкент
Renault 21,"Торг есть 1986г., 1.8 л, Газ-бензин, 999 999 км, Молочный цвет, Седан, КПП Механика, Литые диски, Велюр, Аудиосистема, Bluetooth, CD, MP…",2200,1986,Ургенч
Lifan 620,"Есть доставка 2016г., 1.6 л, Газ-бензин, 127 000 км, Внедорожник, КПП Механика, Алькантара",7000,2016,Ташкент
Москвич 412,"Торг есть 1973г., Газ, Зеленый, Седан, КПП Механика, Рейлинги, Мошина хайдаб юришга таёёр",691,1973,Наманган
"Chevrolet Nexia 3, 2 позиция","2018г., 1.5 л, Газ-бензин, 84 222 км, Седан, КПП Механика, Противотуманки, Аудиосистема, Гидравлика руля, ABS, Подушка безопас…",9000,2018,Самарканд
ВАЗ (Lada) 2106,"1990г., Газ-бензин, Черный, Седан, КПП Механика",1657,1990,Фергана
"Chevrolet Cobalt, 1 позиция","2014г., 1.5 л, Бензин, 39 191 км, Белый, Седан, КПП Механика, Обогрев зеркал, Аудиосистема, Гидравлика руля, Oldin banfer qiri…",9000,2014,Навои
"Chevrolet Lacetti, 3 позиция","Есть доставкаТорг есть 2020г., 1.5 л, Газ-бензин, 53 000 км, Седан, КПП Автомат, Литые диски, Тонировка, Люк, Ксенон, Линзованная оптика, Противотума…",13812,2020,Самарканд
ВАЗ (Lada) 2106,"Торг есть 1983г., Бензин, 200 000 км, Зеленый, Седан, КПП Механика, Кожа, Машина не битый В хорошом состаяние",2500,1983,Самарканд
Ford Transit,"2009г., Дизель, 216 248 км, Дельфин, Внедорожник, КПП Механика, Olasiz dakansa minasiz",10000,2009,Навои
ВАЗ (Lada) 2101,"Торг есть 1974г., Газ, 999 999 км, Седан, КПП Механика, Мошини суйаги бутин кузибида чакалари бор матор 06 ти янги куйилган каропка 5тал…",737,1974,Каттакурганский район
Chevrolet Damas,"Есть доставка 2021г., Газ-бензин, 4 000 км, Белый, Внедорожник, КПП Механика, Damas toza salondan 2021 dekabrda chqan",9000,2021,Алмалык
Chevrolet Niva,"1981г., Газ-бензин, 654 321 км, Внедорожник, КПП Механика, Нива год 1981 прапан газ краски радной 4 валон новый передок бар ко…",2302,1981,Нукус
ВАЗ (Lada) 2106,"Торг есть 1989г., Газ-бензин, 46 800 км, Внедорожник, КПП Механика, Bluetooth, CD, MP3, DVD-чейнджер, Яхши пашти радной састияна",2000,1989,Самарканд
"Chevrolet Nexia 2, 1 позиция DOHC","2009г., 1.6 л, Газ-бензин, 400 000 км, Седан, КПП Механика, Литые диски, Дневные ходовые огни, Противотуманки, Велюр, Шторки,…",5000,2009,Навои
"Chevrolet Cobalt, 4 евро позиция","2015г., 1.5 л, Бензин, 60 987 км, Седан, КПП Автомат, Литые диски, Люк, Рейлинги, Противотуманки, Обогрев зеркал, Аудиосистема…",9700,2015,Самарканд
УАЗ 452,"Есть доставкаТорг есть 1983г., Газ, 999 999 км, Белый, Внедорожник, КПП Механика, Техосмотр пройден, Urilmagan tuliq kiraska bulgan moshina yurib tur…",2302,1983,Чиракчинский район
Chevrolet Damas,"2021г., 1 л, Бензин, 1 800 км, Белый, Микроавтобус, КПП Механика",7827,2021,Хавастский район
"Chevrolet Nexia 2, 2 позиция SOHC","Торг есть 2014г., 1.5 л, Газ-бензин, 182 000 км, Седан, КПП Механика, Аудиосистема, Встроенный телефон, CD-чейнджер, MP3, USB, Гидравлик…",6400,2014,Карши
Changan SC6463,"Торг есть 2014г., Газ, 220 000 км, Фургон, КПП Механика, Кожа, Небитый",9000,2014,Бухара
"Chevrolet Nexia 2, 2 позиция SOHC","2009г., 1.5 л, Газ-бензин, 149 324 км, Седан, КПП Механика, Аудиосистема, Гидравлика руля",5500,2009,Самарканд
BMW 318,"Торг есть 1995г., 1.8 л, Газ, 320 000 км, Белый, Седан, КПП Механика, Литые диски, Ветровики, Велюр, Аудиосистема, USB, Bluetooth, Сигна…",3223,1995,Ургенч
Daewoo Nexia,"Есть доставкаТорг есть 2005г., 1.5 л, Газ-бензин, 247 000 км, Седан, КПП Механика, Литые диски, Дневные ходовые огни, Противотуманки, Велюр, MP3, USB…",5064,2005,Навои
"Chevrolet Cobalt, 2 позиция","2021г., 1.5 л, Газ-бензин, 17 000 км, Мокрый асфальт, Седан, КПП Механика, Литые диски, Спойлер, Обвес, Противотуманки, Обогре…",12431,2021,Чимбайский район
ВАЗ (Lada) 2101,"Есть доставкаТорг есть 1977г., 1.4 л, Газ-бензин, 62 977 км, Красный, Седан, КПП Механика, Аудиосистема, Заднимос каробка жим матор ёг йимайди акумля…",1934,1977,Денау
ЗАЗ Forza,"2014г., Газ-бензин, 130 км, Черный, Хэтчбек, КПП Механика, Встроенный телефон, Kiraska qilingan",4144,2014,Термез
Chevrolet Damas,"Торг есть 2017г., Газ-бензин, 192 000 км, Белый, Универсал, КПП Механика, Литые диски, Велюр, Кожа, Комбинированный, Шторки, Аудиосистем…",7100,2017,Андижан
Chevrolet Damas,"2020г., 1.3 л, Газ-бензин, 16 000 км, Седан, КПП Механика, Кожа, Аудиосистема, MP3, USB",8000,2020,Наманган
Changan SC6443,"Торг есть 2014г., 1.4 л, Газ-бензин, 300 000 км, Белый, Фургон, КПП Механика, Аудиосистема, Гидравлика руля, ABS, Сигнализация, Техосмот…",8000,2014,Джизак
Daewoo Nexia II,"2009г., 1.5 л, Газ-бензин, 224 000 км, Седан, КПП Механика",5000,2009,Джизак
Neta Neta V,"Есть доставкаТорг есть 2021г., 1 л, Электричество, Белый, Внедорожник, КПП Автомат, Литые диски, Корректор фар, Ксенон, Обогрев зеркал, Кожа, Bluetoo…",27000,2021,Ташкент
"Chevrolet Lacetti, 1 позиция Газ-бензин","Торг есть 2016г., 1.8 л, Газ-бензин, 130 км, Серебристый, Седан, КПП Механика, Обогрев зеркал, Аудиосистема, Гидравлика руля, ABS, Полны…",10000,2016,Гузарский район
ВАЗ (Lada) 2107,"Торг есть 1996г., Газ-бензин, Молочный цвет, Седан, КПП Механика, Кожа, Аудиосистема, Гидравлика руля, Техосмотр пройден, Kraska bor кра…",2394,1996,Самарканд
"Chevrolet Cobalt, 4 позиция","2021г., 1.5 л, Бензин, 3 700 км, Седан, КПП Автомат, Литые диски, Противотуманки, Обогрев зеркал, Гидравлика руля, ABS, Подушк…",13000,2021,Андижан
Daewoo Tico,"1998г., Бензин, 526 000 км, Хэтчбек, КПП Механика, Литые диски, Кожа, Аудиосистема, MP3, USB, Moshin zver pul sarflashni xojat…",1842,1998,Хивинский район
Daewoo Labo,"2021г., Бензин, Универсал, КПП Механика, 2022 yil 10 Yanvarda salondan chiqdi Labo rangi oq",8200,2021,Ташкент
Toyota Corolla,"2008г., Бензин, 208 000 км, Белый, Седан, КПП Автомат, Aybi yoq",12000,2008,Термез
"Chevrolet Nexia 2, 2 позиция SOHC","Торг есть 2014г., 1.5 л, Газ-бензин, 136 500 км, Седан, КПП Механика, Аудиосистема, Гидравлика руля, Varyantga yuq naxtga kraska kapotda",6446,2014,Каттакурганский район
"Chevrolet Matiz, 1 позиция","Торг есть 2009г., 0.8 л, Газ-бензин, 281 000 км, Хэтчбек, КПП Механика, Ветровики, Противотуманки, Шторки, Аудиосистема, Центрозамок, Kr…",3600,2009,Ташкент
ГАЗ 14 (Чайка),"1983г., 5 л, Бензин, 99 999 км, Черный, Лимузин, КПП Автомат, Тонировка, Противотуманки, Дневные ходовые огни, Велюр, Аудиосис…",14000,1983,Бухара
Москвич 2141,"Торг есть 1991г., 1.5 л, Бензин, 295 000 км, Серый, Хэтчбек, КПП Механика, Багажник, Обогрев зеркал, Техосмотр пройден, Вложений не треб…",900,1991,Карши
ВАЗ (Lada) 2106,"1981г., 1.6 л, Бензин, Вишня, Седан, КПП Механика",1700,1981,Ташкент
"Chevrolet Nexia 2, 2 позиция SOHC","Торг есть 2009г., 1.5 л, Газ-бензин, 391 000 км, Серый, Седан, КПП Механика, Аудиосистема, Гидравлика руля",5000,2009,Фергана
ВАЗ (Lada) XRAY,"Торг есть 2019г., 1.8 л, Бензин, 40 000 км, Белый, Хэтчбек, КПП Механика, Литые диски, Тонировка, Ветровики, Противотуманки, Обогрев зер…",14000,2019,Самарканд
Daewoo Matiz (Standart),"Торг есть 2007г., Бензин, 377 000 км, Хэтчбек, КПП Механика, Родной краска не битый",4000,2007,Джизак
ГАЗ 3110 (Волга),"Торг есть 2000г., 2.1 л, Газ-бензин, Седан, КПП Механика, Литые диски, Спойлер, Ветровики, Противотуманки, 24 10 матор ремонт болган хад…",3223,2000,Ургенч
Nissan Sunny,"1994г., 1.6 л, Газ-бензин, Белый, Фургон, КПП Механика, Багажник, Аудиосистема, DVD-чейнджер",4200,1994,Наманган
"Chevrolet Nexia 2, 2 позиция DOHC","2009г., 1.6 л, Газ-бензин, 300 000 км, Седан, КПП Механика, Аудиосистема, Техосмотр пройден, 2009 йили матор 1.6 "" краска бор…",4200,2009,Джизак
"Chevrolet Nexia 2, 2 позиция DOHC","2009г., 1.5 л, Газ-бензин, 192 000 км, Седан, КПП Механика, Аудиосистема, Гидравлика руля, Urilmagan, kraskasi borr",5064,2009,Багатский район
Kia Bongo,"Торг есть 2004г., Газ-бензин, Фургон, КПП Механика, 1 yili 2004 2 yangi mator qilingan 3 xamma Joylari yaxshi 4 balon lari o'rta 5 10$ o…",10000,2004,Наманган
Daewoo Nexia,"Торг есть 2009г., 1.5 л, Газ-бензин, 255 000 км, Седан, КПП Механика, Велюр, Алди крило алмашган мижигар кондитсанер бор мотор хадабои я…",5500,2009,Бостанлыкский район
Daewoo Damas,"Есть доставкаТорг есть 1998г., Газ-бензин, 375 000 км, Зеленый, Внедорожник, КПП Механика, Литые диски, Дневные ходовые огни, Омыватель фар, Обогрев…",4300,1998,Джизак
Ravon R4,"Торг есть 2018г., 1.5 л, Газ-бензин, Седан, КПП Механика, Литые диски, Противотуманки, Обогрев зеркал, Аудиосистема, Гидравлика руля, AB…",9900,2018,Андижан
"Chevrolet Spark, 3 позиция","2012г., 1.3 л, Газ-бензин, 249 000 км, Белый, Хэтчбек, КПП Механика, Рейлинги, Противотуманки, Аудиосистема, Гидравлика руля,…",5064,2012,Нукус
Daewoo Matiz (Standart),"Торг есть 2009г., 8 л, Бензин, 400 км, Серебристый, Хэтчбек, КПП Механика, Хуллас гаппи очиги суяги бутун",4000,2009,Чиназ
Москвич АЗЛК 2136 Комби,"Торг есть 1988г., 4 л, Газ-бензин, 77 777 км, Синий, Седан, КПП Механика, Литые диски, MP3",1381,1988,Наманган
Mercedes-Benz S 320,"Торг есть 1987г., Газ-бензин, Черный, Седан, КПП Механика, Литые диски, Люк, Кожа, Srochni sotiladi qolgan malumotlar telfonda",3500,1987,Фергана
Москвич 21412,"1993г., Газ-бензин, 222 222 км, Белый, Пикап, КПП Механика, Рейлинги, Противотуманки, Велюр, Вложений не требует, Moskvich pik…",1657,1993,Наманган
Daewoo Nexia,"2008г., Газ-бензин, 818 523 км, Седан, КПП Механика, Краска бор",3683,2008,Янгиарыкский район
ВАЗ (Lada) 2107,"2011г., Газ-бензин, 122 000 км, Седан, КПП Механика, Мошина родной",4800,2011,Шурчинский район
