Title,Description,Price,Manufactured Year,Region
Daewoo Nexia,"Торг есть 1998г., 7.5 л, Бензин, 60 000 км, Вишня, Седан, КПП Механика, Аудиосистема, Сабвуфер, Гидравлика руля, Кондиционер, Вложений н…",7600,1998,Андижан
ВАЗ (Lada) 2106,"Торг есть 1986г., 1.5 л, Бензин, 98 400 км, Молочный цвет, Седан, КПП Механика, Багажник, Хрустальная оптика, Велюр, Дерево, Вложений не…",1473,1986,Карши
"Chevrolet Lacetti, 2 позиция","Торг есть 2019г., 1.8 л, Газ-бензин, 69 000 км, Белый, Седан, КПП Механика, Противотуманки, Обогрев зеркал, Аудиосистема, Гидравлика рул…",11800,2019,Джизак
Chevrolet Damas,"Торг есть 2022г., 0.8 л, Бензин, 80 км, Белый, Универсал, КПП Механика, Аудиосистема, USB, Вложений не требует, 2022.01.31 kuni chiqdi p…",8350,2022,Фергана
"Chevrolet Cobalt, 2 евро позиция","Торг есть 2015г., 1.5 л, Бензин, 170 000 км, Белый, Седан, КПП Автомат, Ветровики, Дневные ходовые огни, Противотуманки, Обогрев зеркал,…",9600,2015,Ташкент
"Chevrolet Malibu, 3 позиция","Есть доставкаТорг есть 2012г., 2.4 л, Газ-бензин, 137 000 км, Черный, Седан, КПП Автомат, Литые диски, Люк, Противотуманки, Обогрев зеркал, Кожа, Ауд…",17000,2012,Ташкент
ВАЗ (Lada) Нива,"Торг есть 2022г., Бензин, 2 400 км, Внедорожник, КПП Механика, Литые диски, Тонировка, Рейлинги, Багажник, Ксенон, Шторки, Аудиосистема,…",18000,2022,Ташкент
"Chevrolet Lacetti, 3 позиция","Торг есть 2021г., 1.5 л, Бензин, 11 600 км, Седан, КПП Автомат, Литые диски, Тонировка, Люк, Ксенон, Противотуманки, Обогрев зеркал, Ауд…",15800,2021,Ташкент
"Chevrolet Lacetti, 2 позиция","2010г., 1.8 л, Бензин, 90 000 км, Белый, Седан, КПП Механика, Противотуманки, Обогрев зеркал, Кожа, Аудиосистема, Гидравлика р…",8999,2010,Карши
"Chevrolet Cobalt, 4 позиция","Торг есть 2022г., 1.5 л, Бензин, 400 км, Белый, Седан, КПП Автомат, Литые диски, Люк, Рейлинги, Противотуманки, Обогрев зеркал, Гидравли…",12600,2022,Андижан
"Chevrolet Nexia 3, 4 позиция","Торг есть 2020г., 1.5 л, Бензин, 11 000 км, Мокрый асфальт, Седан, КПП Автомат, Литые диски, Противотуманки, Обогрев зеркал, Велюр, Ауди…",10500,2020,Ташкент
"Chevrolet Lacetti, 1 позиция Газ-бензин","Торг есть 2019г., 1.5 л, Газ-бензин, 40 700 км, Седан, КПП Механика, Обогрев зеркал, Аудиосистема, Гидравлика руля, ABS, Полный электроп…",12200,2019,Ташкент
"Chevrolet Nexia 3, 2 позиция","Торг есть 2021г., 1.5 л, Бензин, 10 667 км, Седан, КПП Механика, Дневные ходовые огни, Противотуманки, Корректор фар, Обогрев зеркал, Ко…",9500,2021,Китабский район
"Chevrolet Lacetti, 2 позиция","2009г., 1.8 л, Газ, 150 000 км, Серебристый, Седан, КПП Механика, Ксенон, Аудиосистема, MP3, DVD, Техосмотр пройден",7300,2009,Ургутский район
"Chevrolet Nexia 2, 3 позиция DOHC","2009г., 1.6 л, Газ-бензин, 399 000 км, Седан, КПП Механика, Противотуманки, Аудиосистема, Встроенный телефон, Bluetooth, MP3,…",5400,2009,Наманган
"Chevrolet Nexia 2, 1 позиция SOHC","Торг есть 2014г., 1.5 л, Газ-бензин, 110 000 км, Черный, Седан, КПП Механика, Тонировка, Противотуманки, Велюр, Аудиосистема, Сигнализац…",6329,2014,Ташкент
Daewoo Matiz (Standart),"2010г., Газ, Жёлтый, КПП Механика, Балон куйилганига бир ой хам булгани йок хали",3300,2010,Каган
Daewoo Nexia,"Торг есть 2002г., 1.5 л, Газ-бензин, 500 000 км, Седан, КПП Механика, Шторки, Аудиосистема, Встроенный телефон, Bluetooth, CD, CD-чейндж…",4000,2002,Фергана
УАЗ Patriot,"Есть доставкаТорг есть 2020г., 2.7 л, Газ-бензин, 42 000 км, Внедорожник, КПП Механика, Литые диски, Тонировка, Багажник, Ксенон, Хрустальная оптика,…",17500,2020,Карши
"Chevrolet Lacetti, 1 позиция","2022г., 1.5 л, Бензин, 10 км, Седан, КПП Механика, Обогрев зеркал, Гидравлика руля, ABS, Полный электропакет, Центрозамок, Кон…",13400,2022,Ташкент
Daewoo Nexia,"Торг есть 1998г., 7.5 л, Бензин, 60 000 км, Вишня, Седан, КПП Механика, Аудиосистема, Сабвуфер, Гидравлика руля, Кондиционер, Вложений н…",7600,1998,Андижан
ВАЗ (Lada) 2106,"Торг есть 1986г., 1.5 л, Бензин, 98 400 км, Молочный цвет, Седан, КПП Механика, Багажник, Хрустальная оптика, Велюр, Дерево, Вложений не…",1473,1986,Карши
"Chevrolet Lacetti, 2 позиция","Торг есть 2019г., 1.8 л, Газ-бензин, 69 000 км, Белый, Седан, КПП Механика, Противотуманки, Обогрев зеркал, Аудиосистема, Гидравлика рул…",11800,2019,Джизак
Chevrolet Damas,"Торг есть 2022г., 0.8 л, Бензин, 80 км, Белый, Универсал, КПП Механика, Аудиосистема, USB, Вложений не требует, 2022.01.31 kuni chiqdi p…",8350,2022,Фергана
"Chevrolet Cobalt, 2 евро позиция","Торг есть 2015г., 1.5 л, Бензин, 170 000 км, Белый, Седан, КПП Автомат, Ветровики, Дневные ходовые огни, Противотуманки, Обогрев зеркал,…",9600,2015,Ташкент
"Chevrolet Malibu, 3 позиция","Есть доставкаТорг есть 2012г., 2.4 л, Газ-бензин, 137 000 км, Черный, Седан, КПП Автомат, Литые диски, Люк, Противотуманки, Обогрев зеркал, Кожа, Ауд…",17000,2012,Ташкент
ВАЗ (Lada) Нива,"Торг есть 2022г., Бензин, 2 400 км, Внедорожник, КПП Механика, Литые диски, Тонировка, Рейлинги, Багажник, Ксенон, Шторки, Аудиосистема,…",18000,2022,Ташкент
"Chevrolet Lacetti, 3 позиция","Торг есть 2021г., 1.5 л, Бензин, 11 600 км, Седан, КПП Автомат, Литые диски, Тонировка, Люк, Ксенон, Противотуманки, Обогрев зеркал, Ауд…",15800,2021,Ташкент
"Chevrolet Lacetti, 2 позиция","2010г., 1.8 л, Бензин, 90 000 км, Белый, Седан, КПП Механика, Противотуманки, Обогрев зеркал, Кожа, Аудиосистема, Гидравлика р…",8999,2010,Карши
"Chevrolet Cobalt, 4 позиция","Торг есть 2022г., 1.5 л, Бензин, 400 км, Белый, Седан, КПП Автомат, Литые диски, Люк, Рейлинги, Противотуманки, Обогрев зеркал, Гидравли…",12600,2022,Андижан
"Chevrolet Nexia 3, 4 позиция","Торг есть 2020г., 1.5 л, Бензин, 11 000 км, Мокрый асфальт, Седан, КПП Автомат, Литые диски, Противотуманки, Обогрев зеркал, Велюр, Ауди…",10500,2020,Ташкент
"Chevrolet Lacetti, 1 позиция Газ-бензин","Торг есть 2019г., 1.5 л, Газ-бензин, 40 700 км, Седан, КПП Механика, Обогрев зеркал, Аудиосистема, Гидравлика руля, ABS, Полный электроп…",12200,2019,Ташкент
"Chevrolet Nexia 3, 2 позиция","Торг есть 2021г., 1.5 л, Бензин, 10 667 км, Седан, КПП Механика, Дневные ходовые огни, Противотуманки, Корректор фар, Обогрев зеркал, Ко…",9500,2021,Китабский район
"Chevrolet Lacetti, 2 позиция","2009г., 1.8 л, Газ, 150 000 км, Серебристый, Седан, КПП Механика, Ксенон, Аудиосистема, MP3, DVD, Техосмотр пройден",7300,2009,Ургутский район
"Chevrolet Nexia 2, 3 позиция DOHC","2009г., 1.6 л, Газ-бензин, 399 000 км, Седан, КПП Механика, Противотуманки, Аудиосистема, Встроенный телефон, Bluetooth, MP3,…",5400,2009,Наманган
"Chevrolet Nexia 2, 1 позиция SOHC","Торг есть 2014г., 1.5 л, Газ-бензин, 110 000 км, Черный, Седан, КПП Механика, Тонировка, Противотуманки, Велюр, Аудиосистема, Сигнализац…",6329,2014,Ташкент
Daewoo Matiz (Standart),"2010г., Газ, Жёлтый, КПП Механика, Балон куйилганига бир ой хам булгани йок хали",3300,2010,Каган
Daewoo Nexia,"Торг есть 2002г., 1.5 л, Газ-бензин, 500 000 км, Седан, КПП Механика, Шторки, Аудиосистема, Встроенный телефон, Bluetooth, CD, CD-чейндж…",4000,2002,Фергана
УАЗ Patriot,"Есть доставкаТорг есть 2020г., 2.7 л, Газ-бензин, 42 000 км, Внедорожник, КПП Механика, Литые диски, Тонировка, Багажник, Ксенон, Хрустальная оптика,…",17500,2020,Карши
"Chevrolet Lacetti, 1 позиция","2022г., 1.5 л, Бензин, 10 км, Седан, КПП Механика, Обогрев зеркал, Гидравлика руля, ABS, Полный электропакет, Центрозамок, Кон…",13400,2022,Ташкент
Kia Seltos,"Торг есть 2022г., 2 л, Бензин, 1 км, Черный, Внедорожник, КПП Автомат, Тонировка, Литые диски, Омыватель фар, Хрустальная оптика, Обогре…",34200,2022,Ташкент
"Chevrolet Nexia 3, 4 позиция","Торг есть 2020г., 1.5 л, Бензин, 40 350 км, Седан, КПП Автомат, Литые диски, Дневные ходовые огни, Противотуманки, Обогрев зеркал, Аудио…",10500,2020,Ташкент
Opel Vectra,"Торг есть 2000г., 2.2 л, Газ-бензин, 283 000 км, Серебристый, Седан, КПП Автомат, Ксенон, Противотуманки, Омыватель фар, Корректор фар,…",5500,2000,Ташкент
"Chevrolet Lacetti, 1 позиция Газ-бензин","Торг есть 2019г., 1.5 л, Газ-бензин, 120 000 км, Черный, КПП Механика, Ветровики, Противотуманки, Обогрев зеркал, Аудиосистема, Гидравли…",12500,2019,Ташкент
Chevrolet Malibu 2,"2018г., 2 л, Бензин, 20 300 км, КПП Автомат, Продам свою Malibu 2 Turbo 2.0L Состояние идеальное. Не крашенная не битая, брал…",26500,2018,Ташкент
"Chevrolet Captiva, 1 позиция","Торг есть 2010г., 3.2 л, Бензин, Черный, Кроссовер, КПП Автомат, Люк, Литые диски, Обогрев зеркал, Противотуманки, Кожа, MP3, CD, Аудиос…",15000,2010,Ташкент
"Chevrolet Lacetti, 3 позиция","Торг есть 2021г., 1.6 л, Газ-бензин, 8 900 км, Черный, Седан, КПП Автомат, Литые диски, Люк, Противотуманки, Обогрев зеркал, Аудиосистем…",15500,2021,Ташкент
"Chevrolet Malibu, 2 позиция","Торг есть 2016г., 2.4 л, Бензин, Седан, КПП Механика, Люк, Литые диски, Противотуманки, Обогрев зеркал, Кожа, DVD, CD, Аудиосистема, Blu…",16200,2016,Андижан
"Chevrolet Cobalt, 3 позиция","2013г., 1.5 л, Газ-бензин, 136 000 км, Белый, Седан, КПП Механика, Противотуманки, Обогрев зеркал, Аудиосистема, Гидравлика ру…",8800,2013,Фергана
Chevrolet Niva,"Торг есть 2005г., 1.7 л, Газ-бензин, 1 км, Серебристый, Внедорожник, КПП Механика, Литые диски, Ветровики, Обогрев зеркал, Гидравлика ру…",5400,2005,Наманган
"Chevrolet Lacetti, 3 позиция","Торг есть 2018г., 1.6 л, Газ-бензин, 54 500 км, Белый, Седан, КПП Автомат, Люк, Панорамная крыша, Литые диски, Обогрев зеркал, Противоту…",13600,2018,Джизак
"Chevrolet Spark, 2 позиция","Торг есть 2010г., 1.6 л, Газ-бензин, 195 000 км, Хэтчбек, КПП Механика, Литые диски, Ветровики, Противотуманки, Шторки, Аудиосистема, Вс…",5800,2010,Андижан
Chevrolet Labo,"Торг есть 2020г., 3.5 л, Газ-бензин, 60 000 км, Белый, Фургон, КПП Механика, Литые диски, Обвес, Багажник, Противотуманки, Обогрев зерка…",9200,2020,Карши
"Chevrolet Matiz, 1 позиция","Торг есть 2006г., 0.8 л, Бензин, 273 000 км, Хэтчбек, КПП Механика, Аудиосистема, Техосмотр пройден, Rasxod yo'q balo'nlari yangi hadavo…",3000,2006,Ташкент
"Chevrolet Tracker, 2 позиция","Торг есть 2020г., Газ-бензин, 29 000 км, КПП Автомат, Литые диски, Багажник, Аудиосистема, Встроенный телефон, Bluetooth, CD, CD-чейндже…",17800,2020,Самарканд
УАЗ Patriot,"2018г., 2.7 л, Газ-бензин, 65 000 км, Белый, КПП Механика, Год выпуска 2018 Пробег 65 000 км Кузов Внедорожник 5 дв. Цвет Белы…",18000,2018,Ташкент
"Chevrolet Nexia 3, 2 позиция","2021г., 1.5 л, Газ-бензин, Седан, КПП Механика, Противотуманки, Аудиосистема, ABS, Подушка безопасности, Полный электропакет,…",10700,2021,Ташкент
"Chevrolet Lacetti, 3 позиция","Торг есть 2021г., 1.6 л, Бензин, 5 700 км, Белый, Седан, КПП Автомат, Литые диски, Люк, Противотуманки, Обогрев зеркал, Аудиосистема, Ги…",16000,2021,Ташкент
"Chevrolet Nexia 3, 4 позиция","2020г., 1.5 л, Бензин, 26 000 км, Седан, КПП Автомат, Литые диски, Тонировка, Противотуманки, Обогрев зеркал, Аудиосистема, Ги…",10200,2020,Ташкент
Hyundai Santa Fe,"Торг есть 2006г., 2.7 л, Бензин, Синий, Внедорожник, КПП Автомат, Багажник, Тонировка, Литые диски, Рейлинги, Ветровики, Хрустальная опт…",11300,2006,Ташкент
"Chevrolet Lacetti, 3 позиция","Есть доставка 2021г., 1.5 л, Бензин, 11 300 км, Белый, Седан, КПП Автомат, Литые диски, Люк, Спойлер, Ветровики, Линзованная оптика, Дневные…",14900,2021,Ташкент
Kia Carnival,"Торг есть 2009г., 2.9 л, Газ, 275 000 км, Лимузин, КПП Автомат, Литые диски, Люк, Ветровики, Противотуманки, Обогрев зеркал, Кожа, Аудио…",12500,2009,Кургантепинский район
Mercedes-Benz S 320,"Торг есть 2002г., 3.2 л, Бензин, 200 000 км, Черный, Седан, КПП Автомат, Литые диски, Тонировка, Люк, Панорамная крыша, Спойлер, Ксенон,…",28545,2002,Джизак
Chevrolet Damas,"2014г., 3.8 л, Бензин, 28 000 км, Белый, Седан, КПП Механика, Литые диски, Противотуманки, Обогрев зеркал, Аудиосистема, Встро…",6900,2014,Наманган
"Chevrolet Malibu, 1 позиция","Торг есть 2012г., 2.4 л, Бензин, 3 400 км, Седан, КПП Механика, Литые диски, Противотуманки, Обогрев зеркал, Аудиосистема, Bluetooth, CD…",16500,2012,Дехканабадский район
"Chevrolet Lacetti, 3 позиция","Торг есть 2021г., 1.6 л, Бензин, Седан, КПП Автомат, Багажник, Литые диски, Люк, Тонировка, Противотуманки, Линзованная оптика, Обогрев…",15500,2021,Ташкент
"Chevrolet Cobalt, 2 позиция","Торг есть 2020г., 1.5 л, Бензин, 16 500 км, Седан, КПП Механика, Противотуманки, Обогрев зеркал, Аудиосистема, ABS, Подушка безопасности…",11510,2020,Навои
ВАЗ (Lada) Largus,"Торг есть 2015г., 1.6 л, Газ-бензин, 70 000 км, Универсал, КПП Механика, Аудиосистема, Встроенный телефон, Bluetooth, CD, CD-чейнджер, M…",12600,2015,Бухара
Chevrolet Labo,"2022г., Бензин, 80 км, Белый, Микровэн, КПП Механика, Kraska toza salondan uyga km",8500,2022,Андижан
ВАЗ (Lada) Largus,"Торг есть 2014г., 1.6 л, Газ-бензин, 72 000 км, Хэтчбек, КПП Механика, Аудиосистема, CD, Super mashina hech qanday xarajat yoq",12500,2014,Бухара
Daewoo Damas,"Есть доставкаТорг есть 2019г., 3 л, Бензин, 3 400 км, Белый, КПП Механика, Техосмотр пройден, Вложений не требует, Фирма продает машину собственный Д…",7827,2019,Ташкент
"Chevrolet Cobalt, 2 позиция","Торг есть 2018г., 1.5 л, Бензин, 78 000 км, Мокрый асфальт, Седан, КПП Механика, Противотуманки, Обогрев зеркал, Аудиосистема, ABS, Конд…",10200,2018,Ташкент
"Chevrolet Lacetti, 2 позиция","Торг есть 2010г., 1.8 л, Газ-бензин, Черный, Седан, КПП Механика, Тонировка, Спойлер, Обвес, Ветровики, Противотуманки, Обогрев зеркал,…",9100,2010,Ташкент
"Chevrolet Captiva, 4 позиция","Торг есть 2017г., 2.4 л, Бензин, 28 500 км, Белый, Кроссовер, КПП Автомат, Литые диски, Люк, Рейлинги, Противотуманки, Обогрев зеркал, К…",25000,2017,Самарканд
ВАЗ (Lada) Priora,"Торг есть 2008г., 1.6 л, Бензин, 86 000 км, Красный, Седан, КПП Механика, Литые диски, Тонировка, USB, Аудиосистема, CD, Кондиционер, Кл…",4700,2008,Самарканд
Daewoo Nexia II,"Торг есть 2009г., 1.6 л, Бензин, 142 000 км, Бежевый, Седан, КПП Механика, Аудиосистема, MP3, Сабвуфер, Гидравлика руля, Сигнализация, А…",5600,2009,Бухара
"Chevrolet Lacetti, 1 позиция","Торг есть 2019г., 1.5 л, Бензин, 81 127 км, Седан, КПП Механика, Обогрев зеркал, Аудиосистема, Гидравлика руля, ABS, Подушка безопасност…",11500,2019,Ташкент
Ravon R2,"2018г., 1.2 л, Бензин, 67 600 км, Хэтчбек, КПП Автомат, Гидравлика руля, Подушка безопасности, Сигнализация, Кондиционер, Муль…",8200,2018,Ташкент
"Chevrolet Lacetti, 1 позиция","Торг есть 2022г., 1.5 л, Бензин, 10 км, Белый, Седан, КПП Механика, Противотуманки, Обогрев зеркал, Аудиосистема, Гидравлика руля, ABS,…",13260,2022,Карши
ВАЗ (Lada) 2101,"1973г., Газ, 53 000 км, Седан, КПП Механика, MP3, Kuzif iwi bor",1105,1973,Джизак
ВАЗ (Lada) 2106,"Торг есть 1991г., Газ-бензин, 100 000 км, Черный, Седан, КПП Механика, Литые диски, Обогрев зеркал, Кожа, Аудиосистема, MP3, USB, Встрое…",3500,1991,Наманган
"Chevrolet Cobalt, 2 позиция","2020г., 1.5 л, Газ-бензин, 103 000 км, Седан, КПП Механика, Литые диски, Противотуманки, Обогрев зеркал, Аудиосистема, ABS, По…",11000,2020,Бекабад
Daewoo Nexia,"Торг есть 2009г., 1.6 л, Бензин, 258 000 км, Седан, КПП Механика, Литые диски, Спойлер, Багажник, Ксенон, Противотуманки, Обогрев зеркал…",6248,2009,Турткульский район
Mercedes-Benz S 600,"Торг есть 2011г., 1.8 л, Бензин, 157 000 км, Черный, Седан, КПП Автомат, Линзованная оптика, Биксенон, Кожа, CD, Аудиосистема, MP3, CD-ч…",32000,2011,Ташкент
"Chevrolet Nexia 3, 4 позиция","Торг есть 2020г., 1.5 л, Газ-бензин, Черный, Седан, КПП Автомат, Литые диски, Противотуманки, Обогрев зеркал, Шторки, Bluetooth, Аудиоси…",10800,2020,Ташкент
"Chevrolet Lacetti, 2 позиция","Торг есть 2015г., 1.5 л, Газ-бензин, 74 000 км, Мокрый асфальт, Седан, КПП Механика, Противотуманки, Обогрев зеркал, Аудиосистема, Гидра…",10000,2015,Ташкент
Daewoo Matiz (Standart),"Торг есть 2002г., 0.8 л, Газ-бензин, 2 000 км, Седан, КПП Механика, Тонировка, Велюр, Шторки, Аудиосистема, Встроенный телефон, Bluetoot…",3223,2002,Бухара
"Chevrolet Lacetti, 3 позиция","2007г., 1.6 л, Газ-бензин, 8 000 км, Черный, Седан, КПП Автомат, Литые диски, Тонировка, Люк, Ксенон, Хрустальная оптика, Днев…",10000,2007,Самарканд
Chevrolet Malibu 2,"Торг есть 2020г., 1.5 л, Бензин, 48 000 км, Черный, КПП Автомат, Аудиосистема, Встроенный телефон, Bluetooth, CD, MP3, USB, DVD, Гидравл…",25000,2020,Ташкент
"Chevrolet Lacetti, 3 позиция","2019г., 1.6 л, Бензин, 40 000 км, Белый, Седан, КПП Автомат, Литые диски, Люк, Противотуманки, Обогрев зеркал, Аудиосистема, Г…",14000,2019,Ташкент
Chevrolet Damas,"Торг есть 2016г., Газ-бензин, 166 000 км, Белый, Седан, КПП Механика, Шторки, Аудиосистема, Kraska toza. Balonlari yangi charmhoo. Chexo…",6600,2016,Джизак
"Chevrolet Nexia 3, 2 евро позиция","Торг есть 2020г., 1.5 л, Бензин, Седан, КПП Механика, Обогрев зеркал, Противотуманки, Аудиосистема, ABS, Центрозамок, Подушка безопаснос…",9000,2020,Фергана
